Title,Description,EpisodeDuration(in Minutes),Genres,Actors,Rating,Votes,Years
Agent Carter,"In 1946, Peggy Carter is relegated to secretarial duties in the Strategic Scientific Reserve (SSR). When Howard Stark is accused of treason, he secretly recruits Peggy to clear his name with the help of his butler, Edwin Jarvis.",42,"Action, Adventure, Sci-Fi","Hayley Atwell, ""James DArcy"", Enver Gjokaj, Chad Michael Murray",7.9,75466,2015–2016
Lost in Space,"After crash-landing on an alien planet, the Robinson family fight against all odds to survive and escape, but they're surrounded by hidden dangers.",60,"Adventure, Drama, Family","Maxwell Jenkins, Molly Parker, Toby Stephens, Taylor Russell",7.3,75441,2018–
Merlin,"These are the brand new adventures of Merlin, the legendary sorcerer as a young man, when he was just a servant to young Prince Arthur on the royal court of Camelot, who has soon become his best friend, and turned Arthur into a great king and a legend.",45,"Adventure, Drama, Fantasy","John Hurt, Colin Morgan, Bradley James, Richard Wilson",7.9,75300,2008–2012
Louie,"The life of Louie C.K., a divorced comedian living in New York with two kids.",26,"Comedy, Drama","Louis C.K., Hadley Delany, Ursula Parker, Pamela Adlon",8.5,75197,2010–2015
Da Vinci's Demons,"Follows Leonardo Da Vinci during his early days in Florence, as a young artist, inventor and dreamer, trying to change the future.",60,"Adventure, Biography, Drama","Tom Riley, Gregg Chillin, Eros Vlahos, Laura Haddock",8,74175,2013–2015
The Shield,Follows the lives and cases of a dirty Los Angeles Police Department cop and the unit under his command.,47,"Crime, Drama, Thriller","Michael Chiklis, Catherine Dent, Walton Goggins, Michael Jace",8.7,73531,2002–2008
One Tree Hill,"Half-brothers Lucas and Nathan Scott trade between kinship and rivalry both on the basketball court and in the hearts of their friends in the small, but not so quiet town of Tree Hill, North Carolina.",60,"Drama, Romance, Sport","Chad Michael Murray, James Lafferty, Hilarie Burton, Bethany Joy Lenz",7.7,73211,2003–2012
Billions,"U.S. Attorney Chuck Rhoades goes after hedge fund king Bobby ""Axe"" Axelrod in a battle between two powerful New York figures.",60,Drama,"Paul Giamatti, Damian Lewis, Maggie Siff, David Costabile",8.4,72721,2016–
Euphoria,"A look at life for a group of high school students as they grapple with issues of drugs, sex, and violence.",55,Drama,"Zendaya, Hunter Schafer, Jacob Elordi, Maude Apatow",8.4,71996,2019–
Russian Doll,A cynical young woman in New York City keeps dying and returning to the party that's being thrown in her honor on that same evening. She tries to find a way out of this strange time loop.,30,"Adventure, Comedy, Drama","Natasha Lyonne, Charlie Barnett, Sharlto Copley, Annie Murphy",7.9,70835,2019–
Titans,A team of young superheroes combat evil and other perils.,45,"Action, Adventure, Crime","Brenton Thwaites, Teagan Croft, Anna Diop, Ryan Potter",7.7,70823,I 2018–
The Tudors,A dramatic series about the reign and marriages of King Henry VIII.,60,"Drama, History, Romance","Jonathan Rhys Meyers, Henry Cavill, Anthony Brophy, James Frain",8.1,69957,2007–2010
Star Wars: The Clone Wars,Jedi Knights lead the Grand Army of the Republic against the droid army of the Separatists.,23,"Animation, Action, Adventure","Tom Kane, Dee Bradley Baker, Matt Lanter, James Arnold Taylor",8.3,69586,2008–2020
Master of None,"The personal and professional life of Dev, a 30-year-old actor in New York.",30,"Comedy, Drama","Aziz Ansari, Eric Wareheim, Lena Waithe, Noël Wells",8.3,69540,2015–
Lupin,"Inspired by the adventures of Arsène Lupin, gentleman thief Assane Diop sets out to avenge his father for an injustice inflicted by a wealthy family.",,"Action, Crime, Drama",Omar Sy,7.5,135000,2021-